{
  "schema_version": "1.0.0",
  "run_id": "RUN-T9-001",
  "extraction_status": "no_requirements",
  "summary": "No product requirements are extractable from the supplied input.",
  "items": [],
  "contradictions": [],
  "missing_information": [
    { "id": "MISS-001", "category": "requirements", "description": "No requirements or substantive notes were provided.", "clarification_question": "Please provide the meeting transcript, decisions, or product requirements to document." }
  ],
  "extractor_notes": ["PRD generation must not proceed from this input."]
}
