{
  "schema_version": "1.0.0",
  "run_id": "RUN-T7-1785795812645",
  "extraction_status": "complete",
  "summary": "Three non-functional requirements were extracted: concurrent-user capacity, response-time performance, and Salesforce API integration.",
  "items": [
    {
      "id": "NFR-001",
      "type": "non_functional_requirement",
      "statement": "API must support 10,000 concurrent users.",
      "status": "stated",
      "priority": "Unspecified",
      "category": "performance",
      "target": "API",
      "evidence": [
        {
          "quote": "API must support 10,000 concurrent users.",
          "source_name": "eval_prdgenie_inputs.txt",
          "location": "T7",
          "speaker": null
        }
      ],
      "confidence": 1,
      "related_item_ids": []
    },
    {
      "id": "NFR-002",
      "type": "non_functional_requirement",
      "statement": "Response time < 200ms at p95.",
      "status": "stated",
      "priority": "Unspecified",
      "category": "performance",
      "target": "API",
      "evidence": [
        {
          "quote": "Response time < 200ms at p95.",
          "source_name": "eval_prdgenie_inputs.txt",
          "location": "T7",
          "speaker": null
        }
      ],
      "confidence": 1,
      "related_item_ids": []
    },
    {
      "id": "NFR-003",
      "type": "non_functional_requirement",
      "statement": "Must integrate with Salesforce REST API v52.",
      "status": "stated",
      "priority": "Unspecified",
      "category": "integration",
      "target": "Salesforce REST API v52",
      "evidence": [
        {
          "quote": "Must integrate with Salesforce REST API v52.",
          "source_name": "eval_prdgenie_inputs.txt",
          "location": "T7",
          "speaker": null
        }
      ],
      "confidence": 1,
      "related_item_ids": []
    }
  ],
  "contradictions": [],
  "missing_information": [],
  "extractor_notes": []
}
