{
  "schema_version": "1.0.0",
  "run_id": "RUN-T6-1785795782968",
  "extraction_status": "partial",
  "summary": "Engineering and Design expressed competing implementation preferences that require reconciliation. PM expressed a requested delivery timeframe of March.",
  "items": [
    {
      "id": "CON-001",
      "type": "constraint",
      "statement": "Engineering wants microservices.",
      "status": "suggested",
      "priority": "Unspecified",
      "category": "architecture",
      "target": null,
      "evidence": [
        {
          "quote": "Engineering wants microservices.",
          "source_name": "eval_prdgenie_inputs.txt",
          "location": "T6",
          "speaker": "Engineering"
        }
      ],
      "confidence": 0.99,
      "related_item_ids": [
        "CON-002"
      ]
    },
    {
      "id": "CON-002",
      "type": "constraint",
      "statement": "Design wants single-page app.",
      "status": "suggested",
      "priority": "Unspecified",
      "category": "platform",
      "target": null,
      "evidence": [
        {
          "quote": "Design wants single-page app.",
          "source_name": "eval_prdgenie_inputs.txt",
          "location": "T6",
          "speaker": "Design"
        }
      ],
      "confidence": 0.99,
      "related_item_ids": [
        "CON-001"
      ]
    },
    {
      "id": "DDL-001",
      "type": "deadline",
      "statement": "PM wants it shipped by March.",
      "status": "suggested",
      "priority": "Unspecified",
      "category": "delivery",
      "target": "March",
      "evidence": [
        {
          "quote": "PM wants it shipped by March.",
          "source_name": "eval_prdgenie_inputs.txt",
          "location": "T6",
          "speaker": "PM"
        }
      ],
      "confidence": 0.99,
      "related_item_ids": []
    }
  ],
  "contradictions": [
    {
      "id": "CTR-001",
      "description": "Engineering wants microservices while Design wants single-page app; the source does not reconcile these implementation preferences.",
      "item_ids": [
        "CON-001",
        "CON-002"
      ],
      "resolution_status": "unresolved",
      "clarification_question": "Which implementation approach should be selected, and how should the microservices and single-page app preferences be reconciled?"
    }
  ],
  "missing_information": [],
  "extractor_notes": []
}
