{
  "schema_version": "1.0.0",
  "run_id": "RUN-T7-GROUND-TRUTH",
  "extraction_status": "complete",
  "summary": "The API has exact scalability, p95 response-time, and Salesforce REST API v52 integration requirements.",
  "items": [
    {
      "id": "NFR-001",
      "type": "non_functional_requirement",
      "statement": "API must support 10,000 concurrent users.",
      "status": "stated",
      "priority": "Unspecified",
      "category": "Scalability",
      "target": "10,000 concurrent users",
      "evidence": [
        {
          "quote": "API must support 10,000 concurrent users.",
          "source_name": "eval_prdgenie_inputs.txt",
          "location": "T7",
          "speaker": null
        }
      ],
      "confidence": 1.0,
      "related_item_ids": []
    },
    {
      "id": "NFR-002",
      "type": "non_functional_requirement",
      "statement": "Response time < 200ms at p95.",
      "status": "stated",
      "priority": "Unspecified",
      "category": "Performance",
      "target": "< 200ms at p95",
      "evidence": [
        {
          "quote": "Response time < 200ms at p95.",
          "source_name": "eval_prdgenie_inputs.txt",
          "location": "T7",
          "speaker": null
        }
      ],
      "confidence": 1.0,
      "related_item_ids": []
    },
    {
      "id": "NFR-003",
      "type": "non_functional_requirement",
      "statement": "Must integrate with Salesforce REST API v52.",
      "status": "stated",
      "priority": "Unspecified",
      "category": "Integration",
      "target": "Salesforce REST API v52",
      "evidence": [
        {
          "quote": "Must integrate with Salesforce REST API v52.",
          "source_name": "eval_prdgenie_inputs.txt",
          "location": "T7",
          "speaker": null
        }
      ],
      "confidence": 1.0,
      "related_item_ids": []
    }
  ],
  "contradictions": [],
  "missing_information": [],
  "extractor_notes": [
    "For this evaluation contract, the named external API and exact version are represented once as an integration non-functional requirement."
  ]
}
