{
  "schema_version": "1.0.0",
  "run_id": "RUN-T10-1785792744501",
  "extraction_status": "complete",
  "summary": "SSO login requires a new auth service being built by Team Alpha; the ETA is unknown.",
  "items": [
    {
      "id": "FR-001",
      "type": "functional_requirement",
      "statement": "Provide SSO login.",
      "status": "stated",
      "priority": "Unspecified",
      "category": "authentication",
      "target": null,
      "evidence": [
        {
          "quote": "SSO login requires the new auth service",
          "source_name": "eval_prdgenie_inputs.txt",
          "location": "T10",
          "speaker": null
        }
      ],
      "confidence": 0.91,
      "related_item_ids": [
        "DEP-001"
      ]
    },
    {
      "id": "DEP-001",
      "type": "dependency",
      "statement": "SSO login requires the new auth service, which is being built by Team Alpha. ETA unknown.",
      "status": "stated",
      "priority": "Unspecified",
      "category": "prerequisite service",
      "target": "new auth service",
      "evidence": [
        {
          "quote": "SSO login requires the new auth service which is being built by Team Alpha. ETA unknown.",
          "source_name": "eval_prdgenie_inputs.txt",
          "location": "T10",
          "speaker": "Team Alpha"
        }
      ],
      "confidence": 0.98,
      "related_item_ids": [
        "FR-001"
      ]
    },
    {
      "id": "STK-001",
      "type": "stakeholder",
      "statement": "Team Alpha is building the new auth service.",
      "status": "stated",
      "priority": "Unspecified",
      "category": "team",
      "target": "Team Alpha",
      "evidence": [
        {
          "quote": "the new auth service which is being built by Team Alpha",
          "source_name": "eval_prdgenie_inputs.txt",
          "location": "T10",
          "speaker": "Team Alpha"
        }
      ],
      "confidence": 0.94,
      "related_item_ids": []
    },
    {
      "id": "RISK-001",
      "type": "risk",
      "statement": "The ETA for the new auth service is unknown, which can affect delivery of SSO login.",
      "status": "stated",
      "priority": "Unspecified",
      "category": "delivery uncertainty",
      "target": "new auth service ETA",
      "evidence": [
        {
          "quote": "ETA unknown.",
          "source_name": "eval_prdgenie_inputs.txt",
          "location": "T10",
          "speaker": null
        }
      ],
      "confidence": 0.91,
      "related_item_ids": [
        "DEP-001"
      ]
    }
  ],
  "contradictions": [],
  "missing_information": [],
  "extractor_notes": []
}
