{
  "schema_version": "1.0.0",
  "run_id": "RUN-T10-1785795916172",
  "extraction_status": "complete",
  "summary": "SSO login requires a new authentication service being built by Team Alpha; its ETA is explicitly unknown, creating a delivery risk.",
  "items": [
    {
      "id": "FR-001",
      "type": "functional_requirement",
      "statement": "Provide SSO login.",
      "status": "stated",
      "priority": "Unspecified",
      "category": "authentication",
      "target": "SSO login",
      "evidence": [
        {
          "quote": "SSO login requires the new auth service",
          "source_name": "eval_prdgenie_inputs.txt",
          "location": "T10",
          "speaker": null
        }
      ],
      "confidence": 0.96,
      "related_item_ids": [
        "DEP-001"
      ]
    },
    {
      "id": "DEP-001",
      "type": "dependency",
      "statement": "SSO login requires the new auth service, which is being built by Team Alpha. ETA unknown.",
      "status": "stated",
      "priority": "Unspecified",
      "category": "service_dependency",
      "target": "new auth service",
      "evidence": [
        {
          "quote": "SSO login requires the new auth service which is being built by Team Alpha. ETA unknown.",
          "source_name": "eval_prdgenie_inputs.txt",
          "location": "T10",
          "speaker": null
        }
      ],
      "confidence": 0.99,
      "related_item_ids": [
        "FR-001",
        "RSK-001"
      ]
    },
    {
      "id": "RSK-001",
      "type": "risk",
      "statement": "The ETA for the new auth service is unknown, which may affect delivery of SSO login.",
      "status": "stated",
      "priority": "Unspecified",
      "category": "delivery_risk",
      "target": "new auth service ETA",
      "evidence": [
        {
          "quote": "ETA unknown.",
          "source_name": "eval_prdgenie_inputs.txt",
          "location": "T10",
          "speaker": null
        },
        {
          "quote": "SSO login requires the new auth service",
          "source_name": "eval_prdgenie_inputs.txt",
          "location": "T10",
          "speaker": null
        }
      ],
      "confidence": 0.94,
      "related_item_ids": [
        "DEP-001"
      ]
    }
  ],
  "contradictions": [],
  "missing_information": [],
  "extractor_notes": []
}
